{
  "schema": "simplicio.video-spec/v1",
  "id": "wjr-video-01",
  "client": "wjr-informatica-games",
  "brief": "../coleta/brief.md",
  "sources": "../coleta/",
  "engine": "hyperframes",
  "format": {
    "width": 1080,
    "height": 1920,
    "fps": 30,
    "duration_s": 15,
    "channel": "instagram-reels"
  },
  "entry": "index.html",
  "spec_file": "spec.json",
  "variables_file": "build/variables.json",
  "build": "node scripts/build.mjs",
  "audio": {
    "mode": "procedural",
    "build": "scripts/build.mjs",
    "spec_key": "audio",
    "output": "assets/audio/build/mix.wav",
    "target_lufs": -14,
    "true_peak_db": -1.5,
    "license": "assets/audio/LICENSES.md"
  },
  "voice": {
    "spec_key": "voice",
    "provider": "kokoro",
    "model": "kokoro-v1.0",
    "voice": "pm_alex",
    "lang": "pt-br",
    "license": "Apache-2.0",
    "render": "npm run voice",
    "cache": "assets/audio/vo/manifest.json"
  },
  "clips": {
    "spec_key": "clips",
    "dir": "assets/imagine",
    "count": 5
  },
  "storyboard_file": "storyboard.simplicio.json",
  "authoring": {
    "model": "claude-opus-5-5",
    "prompt_file": "PROMPT.md",
    "effort": "medium"
  },
  "slots": [
    {
      "id": "logo",
      "kind": "logo",
      "status": "draft-from-site",
      "notes": "public PNG from the site; ask for SVG/high-res + usage permission"
    },
    {
      "id": "photo_hero",
      "kind": "image",
      "status": "draft-from-site",
      "notes": "site image looks illustrative; replace with a real store/console photo"
    },
    {
      "id": "photo_bench",
      "kind": "image",
      "status": "draft-from-site",
      "notes": "replace with a real workbench photo or vertical video"
    }
  ],
  "output": "out/video-01.mp4"
}
